{
  "$schema": "https://lloom.dev/schemas/benchmark-suite.v1.schema.json",
  "schemaVersion": 1,
  "profile": "https://lloom.dev/profiles/interchange/v1",
  "id": "example-apple-silicon-27b-benchmarks",
  "name": "Example Apple Silicon 27B Benchmarks",
  "summary": "Example benchmark suite showing method and workload metadata.",
  "license": {
    "id": "MIT",
    "name": "Benchmark metadata license"
  },
  "publisher": {
    "id": "example-lab",
    "name": "Example Lab",
    "url": "https://example.com"
  },
  "source": {
    "type": "community-submission",
    "url": "https://example.com/lloom/benchmarks/example-apple-silicon-27b"
  },
  "submittedAt": "2026-07-07T00:00:00Z",
  "provenance": {
    "createdBy": "example-lab",
    "generatedBy": "lloom benchmark harness",
    "generatorVersion": "1.0.0"
  },
  "methodology": {
    "harness": "lloom-bench",
    "harnessVersion": "1.0.0",
    "command": ["lloom", "bench", "example/example-27b-agent"],
    "promptCorpus": "agentic-coding-smoke-v1",
    "warmupRuns": 1,
    "measurementRuns": 5,
    "streaming": true
  },
  "results": [
    {
      "id": "example-27b-agent-m2max-d2",
      "recipeId": "example-apple-silicon-27b",
      "backendId": "mtplx",
      "model": "example/example-27b-agent",
      "gatewayModel": "example/example-27b-agent",
      "machine": {
        "platformId": "darwin-arm64",
        "chip": "Apple M2 Max",
        "memoryGb": 96,
        "accelerators": ["apple-gpu"],
        "devices": [
          {
            "id": "apple-gpu",
            "kind": "gpu",
            "vendor": "apple",
            "name": "Apple GPU",
            "backend": "metal",
            "accelerators": ["apple-gpu", "metal"]
          }
        ]
      },
      "settings": {
        "contextWindow": 262144,
        "draftDepth": 2
      },
      "workload": {
        "type": "interactive-generation",
        "category": "agentic-coding",
        "tags": ["agentic-coding", "coding-agent", "long-context"],
        "promptTokens": 4096,
        "outputTokens": 128,
        "contextDepth": 4096,
        "concurrency": 1
      },
      "metrics": {
        "generationTokPerSec": 42.5,
        "prefillTokPerSec": 980.0,
        "timeToFirstTokenMs": 850,
        "contextWindow": 262144,
        "peakMemoryGb": 38.4
      },
      "notes": "Synthetic example values; do not use for ranking."
    }
  ]
}
